,name,kashi,lyricist
48,眠り姫,君と僕とで世界を冒険してきたけど泣いたり笑ったりして僕らはどんなときでも手を繋いできたけどいつかは　いつの日かはある朝　僕が目を覚ますと　この世界には君はいないんだね驚かそうとして隠れてみても　君は探しにこないんだAh　君はいつの日か深い眠りにおちてしまうんだねそしたらもう目を覚まさないんだね僕らがいままで冒険した世界と僕は一人で戦わなきゃいけないんだねボーっと火を吹くドラゴンも僕ら二人で戦ったね勇者の剣も見つけてきたよねAh　このまま君が起きなかったらどうしようそんなこと思いながら君の寝顔を見ていたんだこんな青空のときでもどんな嵐のときでも手を繋いできたけどこんなに嬉しいときもどんなに悲しいときもいつかは　いつの日かはある朝　僕が目を覚ますと　この世界には君はいないんだね起こそうとして揺さぶるけど　君はもう目を覚まさないんだAh　君はいつの日か深い眠りにおちてしまうんだねそしたらもう目を覚まさないんだね僕らがいままで冒険した世界と僕は一人で戦わなきゃいけないんだねAh　まだ見ぬ宝も僕ら二人で探しに行ったね星が降る夜に船を出してさAh　このまま君が起きなかったらどうしようそんなこと思いながら君の寝顔を見ていたんだAh　君はいつの日か深い眠りにおちてしまうんだねそしたらもう目を覚まさないんだね僕らがいままで冒険した世界と僕は一人で戦わなきゃいけないんだねボーっと火を吹くドラゴンも僕ら二人で戦ったね勇者の剣も見つけてきたよねAh　このまま君が起きなかったらどうしようそんなこと思いながら君の寝顔を見ていたんだ,Fukase
49,白昼の夢,夕陽が僕を起こして深い海に沈んでいく僕の好きな夜がきて暗い部屋で一人きり花束持って出掛けても世界はいつも静かで椅子に座り星を見ると一人で家に帰るんだ朝　夜の繰り返し寂しくて空を見上げてみる朝　夜の繰り返し朝に眠る夜と夢をみる僕の中にいる悪魔　今夜は僕と遊ぼうよ僕の中にいる天使　今夜は僕と遊ぼうよ僕が「今」を起こして「過去」を眠りにつかせる「未来」は部屋に来ないから僕が迎えに行かなくちゃ朝　夜朝　夜朝　夜の繰り返し寂しくて空を見上げてみる朝　夜の繰り返し夜に眠る僕の夢を見る朝　夜朝　夜もうすぐ僕の部屋に太陽が来るもうすぐ僕の部屋に太陽が来る,Fukase
50,Habit,君たちったら何でもかんでも分類、区別、ジャンル分けしたがるヒトはなぜか分類したがる習性があるとかないとかこの世の中2種類の人間がいるとか言う君たちが標的持ってるヤツとモテないやつとかちゃんとやるヤツとヤッてないヤツとか隠キャ陽キャ？君らは分類しないとどうにも落ち着かない気付かない本能の外側を覗いていかない？　気分が乗らない？つまり　それは　そんな　シンプルじゃないもっと　曖昧で　繊細で　不明瞭なナニカ例えば持ってるのに出せないヤツやってるのにイケないヤツ持ってるのに悟ったふりしてスカしてるうちに不安になっちゃったりするヤツ所詮アンタはギフテッドアタシは普通の主婦ですとそれは良いでしょう？　素晴らしいでしょう？不可能の証明の完成なんじゃない？夢を持てなんて言ってないそんな無責任になりはしないただその習性に喰われないでそんなHabit捨てる度　見えてくる君の価値俺たちだって動物こーゆーのって好物ここまで言われたらどう？普通　腹の底からこうふつふつと俺たちだって動物故に持ち得るOriginalな習性自分で自分を分類するなよ壊して見せろよ　そのBad Habit大人の俺が言っちゃいけない事言っちゃうけど説教するってぶっちゃけ快楽酒の肴にすりゃもう傑作でもって君も進むキッカケになりゃそりゃそれでWin-Winじゃん？こりゃこれで残念じゃんそもそもそれって君次第だしその後なんか俺興味ないわけこの先君はどうしたい？ってヒトに問われる事自体終わりじゃないと信じたいけどそーじゃなきゃかなり非常事態君たちがその分類された普通の箱で燻ってるからさ俺は人生イージーモードずっとそこで眠っててアラサー俺はそもそもスペックが低いだから足掻いて足宛いて醜く吠えた俺のあの頃を分類したら誰の目から見ても明らかすぐ世の中、金だとか、愛だとか、運だとか、縁だとかなぜ2文字で片付けちゃうの俺たちはもっと曖昧で複雑で不明瞭なナニカ悟ったふりして驕るなよ君に君を分類する能力なんてない俺たちだって動物こーゆーのって好物ここまで言われたらどう？普通　腹の底からこうふつふつと俺たちだって動物故に持ち得るOriginalな習性自分で自分を分類するなよ壊して見せろよ　そのBad Habit俺たちだって動物こーゆーのって好物ここまで言われたらどう？普通　腹の底からこうふつふつと俺たちだって動物故に持ち得るOriginalな習性自分で自分を分類するなよ壊して見せろよ　そのBad Habit,Fukase
62,broken bone,最後の公演を終えた日、僕は酒に溺れてた満月が照らすその店で、僕の野望を謳ってたいつまでも、僕は　いつまでも、僕は　この四人でいたいと、それは狼のように月に吠えてたんだよbroken bone (骨折)少しは大人になったら？君にはファンもいるんだし。でも僕は先生でもないし、最初から「正しさ」もないいつまでも、いつまでも、このままでいたいと僕は最初からTV なんかに出れるような人間じゃないのかも知れないねbroken bone (骨折)broken bone (骨折)だからゴロゴロダラダラ僕はメロディを歌ってるbroken bone (骨折)だけどでもでもまだまだ僕の骨折は治らないbroken bone (骨折)だからゴロゴロダラダラ僕は歌詞を詠ってるbroken bone (骨折)だけどでもでもまだまだ僕の骨折は治らない,Fukase
61,Blue Flower,It is like a white crowLike two-headed tortoiseIronic miracleWhy am I bad？(白いカラスのような双頭の亀のような奇跡のいたずらなんで僕が悪いの？)大きい声を出すなよどうせ誰にも聞こえないんだから無様に足掻くお前を見てると僕の笑顔もちょっと崩れてくるそんな顔で僕を見るなよ目に光が無くなってからが始まり何度も何度も謝るなよきっと誰も悪くないんだそれは海で鯱に会うような自然の摂理のようなもの理由なんかそもそも無くてあるとしたら生まれる前の何か赤い花畑に間違いで咲く美しい一輪の青い花ここにも1人やかましい薔薇壊れられると思うなよIt is like a white crowLike two-headed tortoiseIronic miracleWhy am I bad？(白いカラスのような双頭の亀のような奇跡のいたずらなんで僕が悪いの？)あー、ガタガタギャアギャアうるさいめんどくさいからこの際もういっそどいつもこいつも理由を尋ねる答えられんの　喰うヤる寝る共喰いしたりなぶり殺して遊ぶ哺乳類まあようするに最初にお前が見誤るから僕を羊だと間違えるから僕は弱くて卑怯だからお前はそこで吊るされてるんだお前の居る場所を探してみたけど結局はただの肉の塊どちらかというと僕は被害者産まれ変わったら愛されたいなIt is like a white crowLike two-headed tortoiseIronic miracleWhy am I bad？(白いカラスのような双頭の亀のような奇跡のいたずらなんで僕が悪いの？)It is like a white crowLike two-headed tortoiseIronic miracleWhy am I bad？(白いカラスのような双頭の亀のような奇跡のいたずらなんで僕が悪いの？),Fukase
53,向日葵,夜に住んでた私は初めて貴方を見た眩し過ぎてちょっとだけ眩暈がしたんだ紫のライトから聴こえてくる音そんな違いはないけど、ただ羽根を開くくらい初めてキスをした　忍び込んだビルの屋上貴方にとっては気まぐれな　でも私にとってわね真夏に咲く向日葵達のようみんなが貴方を見てるわ私もその中の一人なのねそんなの分かってる貴方が覚えてないような事も私には宝物なのそれを貴方に壊されないように大切に持ってる入道雲は届かない幻のお城飛行機から見ちゃうとそうでもないんだけど何度も何度も　終わらせようと誓った夜も貴方に会うと明けてしまう　私はどうしたらいいの？真夏に咲く向日葵達のようみんなが貴方を見てるわ私もその中の一人なのねそんなの分かってる叶わない恋なのは分かってるよただ貴方を想ってた時間を何に使って良いか分からないまま夏が終わっていく滲んだ祭りの音と我慢してた靴ずれいつも嫌いな写真なのにそれは誰に見せるの？本当に大切なモノだけは絶対手放すなとこれは貴方が教えてくれた事こんな皮肉ってある？真夏に咲く向日葵達のようみんなが貴方を見てるわ私もその中の一人なのねそんなの分かってる,Fukase
54,ピエロ,森の中のサーカスの君はそこのピエロでいつもおどけてみせて、皆を笑わせようとするどんな悲しいときも笑って皆を笑わせようとする本当はとても気にしてる、そのヘンテコな赤い鼻もからかわれても知らんぷり踊って転んで笑ってたねつまづいたんだから涙が出るのが普通なんだよ危ないから空中ブランコなんてしなくていいんだよ「私がやらなきゃ、誰がやるの！」とそう言って君は笑う危ないから綱渡りなんかしないで欲しいんだよでも、君には決めた事があるんでしょう？応援するよ「頑張って！」実は僕は知ってるよ君が練習してる事を何回やってもつまずいていらだってしまう君の事をそれだけやったら上手くいくさ焦る気持ちは分かるけどさ僕はちゃんと見てるよ頑張ってる君の事を寝静まったサーカステントのなか魔法を覚える君をだから、無理だけはしないで欲しいんだよ今日はおやすみ危ないから空中ブランコなんてしなくていいんだよ「私がやらなきゃ、誰がやるの！」とそう言って君は笑う危ないから綱渡りなんかしないで欲しいんだよでも、君には決めた事があるんでしょう？応援するよ「頑張って！」危ないから空中ブランコなんてしなくていいんだよ「私がやらなきゃ、誰がやるの！」とそう言って君は泣いた危ないから空中ブランコなんてしなくていいんだよ「私がやらなきゃ、誰がやるの！」とそう言って君は笑う危ないから綱渡りなんかしないで欲しいんだよでも、君には決めた事があるんでしょう？応援するよ「頑張って！」,Fukase
55,Fight Music,あぁもう嫌になっちゃうな、ほんと何も上手くいかないや戦うべき「敵」は本当は僕らは分かってる99戦中99敗もう涙も出ないよほんと、もうなんつーのそうねコイツは所謂「挫折」だねあーもう何にも考えたくもないや酒でも飲んで全て忘れちまうかそんなことが何の解決にもならないことなんて学校に行ってない僕でもわかるんだ僕らがいますぐ欲しいのは「ソレ」から逃げる「理由」なんかじゃなくて僕らがいますぐ欲しいのは「ソレ」と戦う「勇気」が欲しいんだどれだけ遠くに逃げても「ソレ」は僕の前に立ちはだかるだから僕がいますぐ欲しいのは「ソレ」と戦う「勇気」が欲しいんだAh何で勝てないのかなんて本当は僕も分かってるだって本気なんか出して負けたら　どうする?もうさ戦いを挑むから負けんだ戦わなくていい「理由」を探しにいく為の旅でもふらっと行こうかなあぁもう地球をどれだけ廻ったって少しも楽になんかならないんだそんなことが何の解決にもならないことなんて僕らはずっと解っていたんだ僕らがいますぐ欲しいのは「ソレ」から逃げる「理由」なんかじゃなくて僕らがいますぐ欲しいのは「ソレ」と戦う「勇気」が欲しいんだどれだけ遠くに逃げても「ソレ」は僕の前に立ちはだかるだから僕がいますぐ欲しいのは「ソレ」と戦う「勇気」が欲しいんだ僕がいますぐ欲しいのは「ソレ」から逃げる「理由」なんかじゃなくて僕がいますぐ欲しいのは「ソレ」と戦う「勇気」が欲しいんだどんなに醜く負けても僕は勝つまで戦う「理由」があんだこんな所で負けられない、くらえ僕のカイシンの一撃　イエーイあぁもう嫌になっちゃうよほんと、これで100戦中100敗それでも僕は戦い続けるよ　勝つ為に,Fukase
60,Food,成長するため君を吸収ちゃんと消化して僕の一部に上品ばかりが全てじゃないんだ野蛮に下品にかぶりつくのもまた愛を知らない獣のような純粋で凶暴なその瞳奥に残酷にえぐりこむ価値のあるとこはもっと深くにふざけるなんてマナー違反だ野蛮であっても無礼ではいけない神の恵みに感謝していただく味がなくならないでねJuicy (ジューシー)Crispy (サクサク)Crunchy (ボリボリ)Fluffy (フワフワ)Tender (やわらかい)Chewy (モチモチ)All Delicious時間をかければ良いわけじゃないそれぞれ適した調理法がある寝かせるもの、サッとやるもの味付けの濃いもの、素材を活かすもの新鮮なもの、腐敗したもの固くするもの、柔らかくするもの食べ頃もある、旬もあるそれはもちろんそれはそうさじゃあさ僕はどうなんだい？食べ頃も過ぎて旬も過ぎたかい？美味しいまんまでいれてるのかなコックの腕が試される時だね嫌がったって胃袋にねじ込む一度食べたら忘れられない味に神の恵みに感謝していただく味がなくならないでねJuicy (ジューシー)Crispy (サクサク)Crunchy (ボリボリ)Fluffy (フワフワ)Tender (やわらかい)Chewy (モチモチ)All DeliciousJuicy (ジューシー)Crispy (サクサク)Crunchy (ボリボリ)Fluffy (フワフワ)Tender (やわらかい)Chewy (モチモチ)All Delicious,Fukase
30,スノーマジックファンタジー,スノーマジックファンタジー雪の魔法にかけられて僕は君に恋したもしかして君は雪の妖精?僕は星の降る雪山で、君を見るまではオカルトの類はまったく信じていなかったのだけれども君が住む山は“スノーランド”1年中、雪の降るこの国で私は生まれたの、と君は話してくれたんだねぇ、私は夏を見たことがないの、燃えるようなあの夏を、それを見るのが私の夢なのでも良いのこの世界は知らない方がロマンチックな事もたくさんあるのでしょう?スノーマジックファンタジー雪の魔法にかけられて僕は君に恋したもしかして君は雪の精?僕はこれまでの人生を誰にも愛されることもなく1人で生きてきた君と出逢うその時まではふいに、「君は妖精だから、やっぱり年齢は200歳とかなのかい?」と聞いたら、それはなんか無視されたねぇ、命はいずれ終わるものよ貴方と私は終わりがくるのなのに、なんで出逢ってしまったの?貴方は「幸せ」と同時に「悲しみ」も運んできたわ皮肉なものねスノーマジックファンタジー雪の魔法にかけられて僕は君に恋したもしかして君は雪の精?雪の妖精とのファンタジーやがて、僕は眠くなってきた君と一緒にいるという事は、やはりこういう事だったんだろうでも良いんだ、君に出逢えて初めて誰かを愛せたんだこれが僕のハッピーエンドスノーマジックファンタジー雪の魔法にかけられて僕は君に恋したもしかして君は雪の精?雪の妖精とのファンタジー,Fukase
57,ファンタジー,Let's sing a song　Wipe your tearsand people　Let's sing alongLet's sing a song　Wipe your tearsPut your hands upいつだって僕たちの365日は“Heartache”ばっかりで元気がなくなっちまうなそりゃまあソレも愛すべき敵だけど今日くらいはあっちいってくれよ今日は幻想的な世界へ連れてってあげる僕らにはこんなことしか出来ないけど今日は君に笑ってほしいんだ僕らにはこんなことしか出来ないけど今日は君に歌ってほしいんだLet's sing a song　Wipe your tearsand people　Let's sing alongLet's sing a song　Wipe your tearsPut your hands up　Let's sing alongいつだって僕たちの365日は“Heartbreak”ばっかりでナミダがなくなっちまうなそりゃまあ音楽なんかじゃ何にも変えられないのかも知れないけど今日は幻想的な世界へ連れてってあげる僕らにはこんなことしか出来ないけど今日は君に歌ってほしいんだ僕らにはこんなことしか出来ないけど今日は君に笑ってほしいんだLet's sing a song　Wipe your tearsand people　Let's sing alongLet's sing a song　Wipe your tearsPut your hands up　Let's sing along,Fukase
29,スターライトパレード,Welcome to the “STARLIGHT PARADE”星が降る眠れない夜にもう一度連れて行ってあの世界へ眠れない僕たちはいつも夢のなか太陽が沈む頃僕らはまた一人だね僕の一つの願いは綺麗な星空にまた消えていくんだWelcome to the “STARLIGHT PARADE”星が降る眠れない夜に僕たちを連れて行ったあの世界Please take me the “STARLIGHT PARADE”星が降る眠れない夜にもう一度連れて行ってあの世界へ時間が止まったようなあの夜も笑ってた君はもうここにはいないんだね聖なる夜に“world requiem”を謳うと星に願うんだWelcome to the “STARLIGHT PARADE”星が降る眠れない夜に僕たちを連れて行ったあの世界Please take me the “STARLIGHT PARADE”星が降る眠れない夜にもう一度連れて行ってあの世界へWelcome to the “STARLIGHT PARADE”星が降る眠れない夜に僕たちを連れて行ったあの世界僕たちは探していくんだ夜空の星が射す方へもう君がいなくなったこの世界でそれはまるで僕たちの文明が奪った夜空の光の様に,Fukase
74,Missing,君は突然　僕の前から居なくなったカラダだけ残してどこかへ消えたんだ居場所の手掛かりを探して部屋をひっくり返した本当に突然？　いつから居ないのかさえ分からない居なくなった理由など　心当たりばっかりで君の考えてた事なんか少しも分からない行く当てもないけど家を飛び出したんだ僕と写る君の笑顔の写真を1枚持ってトビウオの道案内喋る樹リアルとアンリアルの国境を渡り君を探して　幾千の夜を越えて僕は君との想い出を思い出してた宝物のようなさ君を探して　旅に出たんだ君の好きだった場所へ逢えたら話したい事ばっかりだよ君を探して　夜を越えていく僕は君を　思い出してた君を探して　夜を越えていく僕は君を　思い出してたいつだって僕は　自分の事で一杯で君の気持ちなんか分かってるようで分かってなかったちゃんと私を見て　と言われたその声も記憶が歪んでて　ちゃんと思い出せないんだ緑の猿と泣くロボット働き過ぎで人が死んでく島を通り君を探して　幾千の夜を越えてボロボロのリュックに君に言いたい言葉がいっぱい詰まってる君を探して　旅に出たんだぐしゃぐしゃになった1枚の写真僕だけ笑ってないんだこれってもしかして僕を探して　旅に出たんだ先に居なくなった僕をカラダだけ残して遠くに行った僕を迎えに行ってくれてたんだ君の好きな場所じゃなくて僕の好きな場所に君は居るんだね僕を探して　旅に出たんだ君の前から　居なくなった僕を僕を探して　旅に出たんだ君の前から　居なくなった僕を,Fukase
1,青い太陽,"Our sun exists independently of all stars,and the only star that can not exist at night.It's the light that emitted from the sun have caused that.The“light”is“condition for existence”of the sun,and it means eternal solitude.The sun shines on the world as“symbol of solitude”also today.(私達の太陽は全ての星から独立した存在でありただ1つ「夜」に存在出来ない星である。その理由は太陽から発せられる「光」にあった。その「光」とは太陽の「存在条件」でありそれは永遠の孤独を意味した今日も太陽は「孤独の象徴」として世界を照らす。)宇宙の青い太陽は今宵終わりを迎える青色に輝いて「当然」の空を「無色」に照らす僕等の世界は太陽を無色の色とみなすそんな世界から僕達の「太陽」が消えるのでした世界の終わりに青い星が降る僕達の空に咲く青い花Our sun is going to end. Our sun is going to die.Then we are going to notice that the sun have shone on our world.(私達の太陽はいずれ終わっていくのだろう。私達の太陽はいずれ死んでいくのだろう。その時、私達の世界は太陽に照らされていたんだと解るのだろう。)Our sun is going to end. Our sun is going to die.Then we are going to notice that our earth have shonewith the color of the sun.(私達の太陽はいずれ終わっていくのだろう。私達の太陽はいずれ死んでいくのだろう。その時、私達の地球は太陽の色に輝いていたんだと解るのだろう。)僕らの赤い太陽は永遠に輝くのでしょう赤色に輝いて「当然」の空を「無色」に照らす僕等の世界は太陽を無色の色とみなすそんな世界から僕達の「無色」が消えるのでした世界の終わりに青い星が降る僕達の空に咲く青い花Our sun is going to end. Our sun is going to die.Then we are going to notice that the sun have shone on our world.(私達の太陽はいずれ終わっていくのだろう。私達の太陽はいずれ死んでいくのだろう。その時、私達の世界は太陽に照らされていたんだと解るのだろう。)Our sun is going to end. Our sun is going to die.Then we are going to notice that our earth have shonewith the color of the sun.(私達の太陽はいずれ終わっていくのだろう。私達の太陽はいずれ死んでいくのだろう。その時、私達の世界は太陽に照らされていたんだと解るのだろう。)世界の終わりに青い星が降る僕達の空に咲く青い花",Fukase
3,umbrella,鏡に映る私は透明だった分かってた事でも知らないままの方が良かった私は君を濡らすこの忌々しい雨から君を守る為のそれだけの傘それは自分で決めたようで運命みたいなもの何も望んではいけない　傷付くのが怖いからもう一度あの日に戻れたとしても繰り返してしまうでしょう　私はきっとそうこの雨がこのままずっと降れば願ってはいけない　そんな事は分かってる　だけど君に降る雨が　いつの日か上がって青空を望んだらその時私はきっともっと自分の事をこんなに知らなければもう少し幸せな未来も望めたのかなあの雪の日　私を閉じ空を見上げた泣いているように見えた笑顔に私は触れられない哀しくて美しい思い出が走馬灯のように　希望がちらついてしまうこの醜くて本当の気持ちが強くなる前にきっと吐き気がするほど眩しい太陽私の気持ちは自由だと誰かが言ったそんな事ないわ　運命よりも変えられないのこの雨がこのままずっと降れば願ってはいけない　そんな事は分かっていたはず君に降る雨が　いつの日か上がって青空を望んだらその時私はきっと雨が静かに上がり傘立てに置かれた傘忘れた事さえ忘れられてしまったような,Fukase
